<?xml version="1.0" encoding="UTF-8"?>
<xs:schema xmlns:xs="http://www.w3.org/2001/XMLSchema"
	elementFormDefault="qualified">
	
	<!-- Custom Types -->
	<xs:simpleType name="email">
		<xs:restriction base="xs:string">
			<xs:pattern value="[A-Za-z|_|\.]+[@]{1}[A-Za-z|\-|]+[\.]{1}[A-Za-z|\-]+([\.]{1}[A-Za-z|\-]+)*"/>
		</xs:restriction>
	</xs:simpleType>

	<!-- Schema -->
	<xs:element name="hotels">
		<xs:complexType>
			<xs:sequence>
				<xs:element name="hotel" maxOccurs="unbounded">
					<xs:complexType>
						<xs:sequence>
							<xs:element name="city" type="xs:string" />
							<xs:element name="country" type="xs:string" />
							<xs:element name="id" type="xs:positiveInteger" />
							<xs:element name="name" type="xs:string" />
							<xs:element name="address" type="xs:string"/>
							<xs:element name="email" type="email"/>
							<xs:element name="telephone" type="xs:string"/>
						</xs:sequence>
					</xs:complexType>
				</xs:element>
			</xs:sequence>
		</xs:complexType>
	</xs:element>

</xs:schema>
